{
  "schema": "pet-rig-v2",
  "coordinateSystem": {
    "handedness": "right",
    "up": "+Y",
    "forward": "+X"
  },
  "motionRoot": "__motion_root__",
  "canvas": [
    48,
    48
  ],
  "displayScale": 2,
  "sourceFacing": -1,
  "joints": [
    {
      "id": "__motion_root__",
      "name": "Motion Root",
      "parent": null,
      "role": "motion_root",
      "deform": false,
      "restLocal": {
        "translation": [
          0,
          0,
          0
        ],
        "rotation": [
          0,
          0,
          0,
          1
        ],
        "scale": [
          1,
          1,
          1
        ]
      },
      "poseDofs": {
        "translation": false,
        "rotation": false,
        "scale": false
      },
      "limits": {},
      "sprite": null
    },
    {
      "id": "bip001_pelvis",
      "name": "Bip001 Pelvis",
      "parent": "__motion_root__",
      "role": "bone",
      "deform": true,
      "restLocal": {
        "translation": [
          -0.0,
          0.0,
          -0.0
        ],
        "rotation": [
          -0.5,
          -0.5,
          -0.499999,
          0.500001
        ],
        "scale": [
          1,
          1,
          1
        ]
      },
      "poseDofs": {
        "translation": false,
        "rotation": true,
        "scale": false
      },
      "limits": {},
      "sprite": null
    },
    {
      "id": "bip001_l_thigh",
      "name": "Bip001 L Thigh",
      "parent": "bip001_pelvis",
      "role": "bone",
      "deform": true,
      "restLocal": {
        "translation": [
          0.0,
          0.0,
          0.078879
        ],
        "rotation": [
          -0.012991,
          -0.999433,
          -0.010042,
          0.029405
        ],
        "scale": [
          1,
          1,
          1
        ]
      },
      "poseDofs": {
        "translation": false,
        "rotation": true,
        "scale": false
      },
      "limits": {},
      "sprite": null
    },
    {
      "id": "bip001_l_calf",
      "name": "Bip001 L Calf",
      "parent": "bip001_l_thigh",
      "role": "bone",
      "deform": true,
      "restLocal": {
        "translation": [
          0.375725,
          -0.0,
          -0.0
        ],
        "rotation": [
          0.0,
          0.0,
          -0.000691,
          1.0
        ],
        "scale": [
          1,
          1,
          1
        ]
      },
      "poseDofs": {
        "translation": false,
        "rotation": true,
        "scale": false
      },
      "limits": {},
      "sprite": null
    },
    {
      "id": "bip001_l_calf_adv",
      "name": "Bip001 L Calf Adv",
      "parent": "bip001_l_calf",
      "role": "bone",
      "deform": true,
      "restLocal": {
        "translation": [
          1e-06,
          -0.0,
          0.0
        ],
        "rotation": [
          -0.0,
          0.0,
          -0.0,
          1.0
        ],
        "scale": [
          1,
          1,
          1
        ]
      },
      "poseDofs": {
        "translation": false,
        "rotation": true,
        "scale": false
      },
      "limits": {},
      "sprite": null
    },
    {
      "id": "jh_l",
      "name": "JH_L",
      "parent": "bip001_l_calf_adv",
      "role": "bone",
      "deform": true,
      "restLocal": {
        "translation": [
          0.331013,
          0.018908,
          -0.005775
        ],
        "rotation": [
          0.114543,
          -0.061584,
          0.204332,
          0.970225
        ],
        "scale": [
          1,
          1,
          1
        ]
      },
      "poseDofs": {
        "translation": false,
        "rotation": true,
        "scale": false
      },
      "limits": {},
      "sprite": null
    },
    {
      "id": "bip001_l_foot",
      "name": "Bip001 L Foot",
      "parent": "bip001_l_calf",
      "role": "bone",
      "deform": true,
      "restLocal": {
        "translation": [
          0.404121,
          -0.0,
          0.0
        ],
        "rotation": [
          0.121625,
          -0.0284,
          -0.005113,
          0.992157
        ],
        "scale": [
          1,
          1,
          1
        ]
      },
      "poseDofs": {
        "translation": false,
        "rotation": true,
        "scale": false
      },
      "limits": {},
      "sprite": null
    },
    {
      "id": "bip001_l_toe0",
      "name": "Bip001 L Toe0",
      "parent": "bip001_l_foot",
      "role": "bone",
      "deform": true,
      "restLocal": {
        "translation": [
          0.10004,
          0.080283,
          4.1e-05
        ],
        "rotation": [
          -0.001528,
          -0.001523,
          0.708719,
          0.705488
        ],
        "scale": [
          1,
          1,
          1
        ]
      },
      "poseDofs": {
        "translation": false,
        "rotation": true,
        "scale": false
      },
      "limits": {},
      "sprite": null
    },
    {
      "id": "knee_l",
      "name": "knee_L",
      "parent": "bip001_l_calf",
      "role": "bone",
      "deform": true,
      "restLocal": {
        "translation": [
          1e-06,
          0.0,
          0.0
        ],
        "rotation": [
          -0.0,
          0.0,
          0.705808,
          0.708403
        ],
        "scale": [
          1,
          1,
          1
        ]
      },
      "poseDofs": {
        "translation": false,
        "rotation": true,
        "scale": false
      },
      "limits": {},
      "sprite": null
    },
    {
      "id": "bip001_l_thigh_twis",
      "name": "Bip001 L Thigh_Twis",
      "parent": "bip001_l_thigh",
      "role": "bone",
      "deform": true,
      "restLocal": {
        "translation": [
          0.0,
          0.0,
          0.0
        ],
        "rotation": [
          -4e-05,
          0.0,
          0.0,
          1.0
        ],
        "scale": [
          1,
          1,
          1
        ]
      },
      "poseDofs": {
        "translation": false,
        "rotation": true,
        "scale": false
      },
      "limits": {},
      "sprite": null
    },
    {
      "id": "thigh_fix02",
      "name": "Thigh_fix02",
      "parent": "bip001_l_thigh",
      "role": "bone",
      "deform": true,
      "restLocal": {
        "translation": [
          0.044746,
          0.060602,
          0.001471
        ],
        "rotation": [
          -0.998871,
          -0.002039,
          0.046504,
          0.009494
        ],
        "scale": [
          1,
          1,
          1
        ]
      },
      "poseDofs": {
        "translation": false,
        "rotation": true,
        "scale": false
      },
      "limits": {},
      "sprite": null
    },
    {
      "id": "thigh_fix03",
      "name": "Thigh_fix03",
      "parent": "bip001_l_thigh",
      "role": "bone",
      "deform": true,
      "restLocal": {
        "translation": [
          0.035132,
          -0.006547,
          -0.059495
        ],
        "rotation": [
          -0.697405,
          0.114499,
          0.05488,
          0.70534
        ],
        "scale": [
          1,
          1,
          1
        ]
      },
      "poseDofs": {
        "translation": false,
        "rotation": true,
        "scale": false
      },
      "limits": {},
      "sprite": null
    },
    {
      "id": "bip001_r_thigh",
      "name": "Bip001 R Thigh",
      "parent": "bip001_pelvis",
      "role": "bone",
      "deform": true,
      "restLocal": {
        "translation": [
          0.0,
          -0.0,
          -0.078879
        ],
        "rotation": [
          0.009392,
          0.999471,
          -0.01015,
          0.029442
        ],
        "scale": [
          1,
          1,
          1
        ]
      },
      "poseDofs": {
        "translation": false,
        "rotation": true,
        "scale": false
      },
      "limits": {},
      "sprite": null
    },
    {
      "id": "bip001_r_calf",
      "name": "Bip001 R Calf",
      "parent": "bip001_r_thigh",
      "role": "bone",
      "deform": true,
      "restLocal": {
        "translation": [
          0.375726,
          -0.0,
          -0.0
        ],
        "rotation": [
          -0.0,
          -0.0,
          -0.000691,
          1.0
        ],
        "scale": [
          1,
          1,
          1
        ]
      },
      "poseDofs": {
        "translation": false,
        "rotation": true,
        "scale": false
      },
      "limits": {},
      "sprite": null
    },
    {
      "id": "bip001_r_calf_adv",
      "name": "Bip001 R Calf Adv",
      "parent": "bip001_r_calf",
      "role": "bone",
      "deform": true,
      "restLocal": {
        "translation": [
          -0.0,
          0.0,
          0.0
        ],
        "rotation": [
          0.0,
          1e-06,
          0.0,
          1.0
        ],
        "scale": [
          1,
          1,
          1
        ]
      },
      "poseDofs": {
        "translation": false,
        "rotation": true,
        "scale": false
      },
      "limits": {},
      "sprite": null
    },
    {
      "id": "jh_r",
      "name": "JH_R",
      "parent": "bip001_r_calf_adv",
      "role": "bone",
      "deform": true,
      "restLocal": {
        "translation": [
          0.331013,
          0.018908,
          0.005771
        ],
        "rotation": [
          -0.114959,
          0.061603,
          0.205891,
          0.969845
        ],
        "scale": [
          1,
          1,
          1
        ]
      },
      "poseDofs": {
        "translation": false,
        "rotation": true,
        "scale": false
      },
      "limits": {},
      "sprite": null
    },
    {
      "id": "bip001_r_foot",
      "name": "Bip001 R Foot",
      "parent": "bip001_r_calf",
      "role": "bone",
      "deform": true,
      "restLocal": {
        "translation": [
          0.404118,
          0.0,
          -0.0
        ],
        "rotation": [
          -0.121727,
          0.028033,
          -0.001533,
          0.992166
        ],